adult,belongs_to_collection,budget,genres,homepage,id,imdb_id,original_language,original_title,overview,popularity,poster_path,production_companies,production_countries,release_date,revenue,runtime,spoken_languages,status,tagline,title,video,vote_average,vote_count,new_id,keywords
False,"{'id': 10194, 'name': 'Toy Story Collection', 'poster_path': '/7G9915LfUQ2lVfwMEEhDsn3kT4B.jpg', 'backdrop_path': '/9FBwqcd9IRruEDUrTdcaafOMKUq.jpg'}",30000000,"[{'id': 16, 'name': 'Animation'}, {'id': 35, 'name': 'Comedy'}, {'id': 10751, 'name': 'Family'}]",http://toystory.disney.com/toy-story,862,tt0114709,en,Toy Story,"Led by Woody, Andy's toys live happily in his room until Andy's birthday brings Buzz Lightyear onto the scene. Afraid of losing his place in Andy's heart, Woody plots against Buzz. But when circumstances separate Buzz and Woody from their owner, the duo eventually learns to put aside their differences.",21.946943,/uXDfjJbdP4ijW5hWSBrPrlKpxab.jpg,"[{'name': 'Pixar Animation Studios', 'id': 3}]","[{'iso_3166_1': 'US', 'name': 'United States of America'}]",1995-10-30,373554033,81.0,"[{'iso_639_1': 'en', 'name': 'English'}]",Released,,Toy Story,False,7.7,5415,1,"[{'id': 931, 'name': 'jealousy'}, {'id': 4290, 'name': 'toy'}, {'id': 5202, 'name': 'boy'}, {'id': 6054, 'name': 'friendship'}, {'id': 9713, 'name': 'friends'}, {'id': 9823, 'name': 'rivalry'}, {'id': 165503, 'name': 'boy next door'}, {'id': 170722, 'name': 'new toy'}, {'id': 187065, 'name': 'toy comes to life'}]"
False,,65000000,"[{'id': 12, 'name': 'Adventure'}, {'id': 14, 'name': 'Fantasy'}, {'id': 10751, 'name': 'Family'}]",,8844,tt0113497,en,Jumanji,"When siblings Judy and Peter discover an enchanted board game that opens the door to a magical world, they unwittingly invite Alan -- an adult who's been trapped inside the game for 26 years -- into their living room. Alan's only hope for freedom is to finish the game, which proves risky as all three find themselves running from giant rhinoceroses, evil monkeys and other terrifying creatures.",17.015539,/bdHG5Mo83VPobeZZdlSz0Y7HQHB.jpg,"[{'name': 'TriStar Pictures', 'id': 559}, {'name': 'Teitler Film', 'id': 2550}, {'name': 'Interscope Communications', 'id': 10201}]","[{'iso_3166_1': 'US', 'name': 'United States of America'}]",1995-12-15,262797249,104.0,"[{'iso_639_1': 'en', 'name': 'English'}, {'iso_639_1': 'fr', 'name': 'Français'}]",Released,Roll the dice and unleash the excitement!,Jumanji,False,6.9,2413,2,"[{'id': 10090, 'name': 'board game'}, {'id': 10941, 'name': 'disappearance'}, {'id': 15101, 'name': ""based on children's book""}, {'id': 33467, 'name': 'new home'}, {'id': 158086, 'name': 'recluse'}, {'id': 158091, 'name': 'giant insect'}]"
False,"{'id': 119050, 'name': 'Grumpy Old Men Collection', 'poster_path': '/nLvUdqgPgm3F85NMCii9gVFUcet.jpg', 'backdrop_path': '/hypTnLot2z8wpFS7qwsQHW1uV8u.jpg'}",0,"[{'id': 10749, 'name': 'Romance'}, {'id': 35, 'name': 'Comedy'}]",,15602,tt0113228,en,Grumpier Old Men,"A family wedding reignites the ancient feud between next-door neighbors and fishing buddies John and Max. Meanwhile, a sultry Italian divorcée opens a restaurant at the local bait shop, alarming the locals who worry she'll scare the fish away. But she's less interested in seafood than she is in cooking up a hot time with Max.",11.7129,/1FSXpj5e8l4KH6nVFO5SPUeraOt.jpg,"[{'name': 'Warner Bros.', 'id': 6194}, {'name': 'Lancaster Gate', 'id': 19464}]","[{'iso_3166_1': 'US', 'name': 'United States of America'}]",1995-12-22,0,101.0,"[{'iso_639_1': 'en', 'name': 'English'}]",Released,Still Yelling. Still Fighting. Still Ready for Love.,Grumpier Old Men,False,6.5,92,3,"[{'id': 1495, 'name': 'fishing'}, {'id': 12392, 'name': 'best friend'}, {'id': 179431, 'name': 'duringcreditsstinger'}, {'id': 208510, 'name': 'old men'}]"
False,,16000000,"[{'id': 35, 'name': 'Comedy'}, {'id': 18, 'name': 'Drama'}, {'id': 10749, 'name': 'Romance'}]",,31357,tt0114885,en,Waiting to Exhale,"Cheated on, mistreated and stepped on, the women are holding their breath, waiting for the elusive ""good man"" to break a string of less-than-stellar lovers. Friends and confidants Vannah, Bernie, Glo and Robin talk it all out, determined to find a better way to breathe.",3.859495,/qJU6rfil5xLVb5HpJsmmfeSK254.jpg,"[{'name': 'Twentieth Century Fox Film Corporation', 'id': 306}]","[{'iso_3166_1': 'US', 'name': 'United States of America'}]",1995-12-22,81452156,127.0,"[{'iso_639_1': 'en', 'name': 'English'}]",Released,Friends are the people who let you be yourself... and never let you forget it.,Waiting to Exhale,False,6.1,34,4,"[{'id': 818, 'name': 'based on novel'}, {'id': 10131, 'name': 'interracial relationship'}, {'id': 14768, 'name': 'single mother'}, {'id': 15160, 'name': 'divorce'}, {'id': 33455, 'name': 'chick flick'}]"
False,"{'id': 96871, 'name': 'Father of the Bride Collection', 'poster_path': '/nts4iOmNnq7GNicycMJ9pSAn204.jpg', 'backdrop_path': '/7qwE57OVZmMJChBpLEbJEmzUydk.jpg'}",0,"[{'id': 35, 'name': 'Comedy'}]",,11862,tt0113041,en,Father of the Bride Part II,"Just when George Banks has recovered from his daughter's wedding, he receives the news that she's pregnant ... and that George's wife, Nina, is expecting too. He was planning on selling their home, but that's a plan that -- like George -- will have to change with the arrival of both a grandchild and a kid of his own.",8.387519,/rj4LBtwQ0uGrpBnCELr716Qo3mw.jpg,"[{'name': 'Sandollar Productions', 'id': 5842}, {'name': 'Touchstone Pictures', 'id': 9195}]","[{'iso_3166_1': 'US', 'name': 'United States of America'}]",1995-02-10,76578911,106.0,"[{'iso_639_1': 'en', 'name': 'English'}]",Released,Just When His World Is Back To Normal... He's In For The Surprise Of His Life!,Father of the Bride Part II,False,5.7,173,5,"[{'id': 1009, 'name': 'baby'}, {'id': 1599, 'name': 'midlife crisis'}, {'id': 2246, 'name': 'confidence'}, {'id': 4995, 'name': 'aging'}, {'id': 5600, 'name': 'daughter'}, {'id': 10707, 'name': 'mother daughter relationship'}, {'id': 13149, 'name': 'pregnancy'}, {'id': 33358, 'name': 'contraception'}, {'id': 170521, 'name': 'gynecologist'}]"
False,,60000000,"[{'id': 28, 'name': 'Action'}, {'id': 80, 'name': 'Crime'}, {'id': 18, 'name': 'Drama'}, {'id': 53, 'name': 'Thriller'}]",,949,tt0113277,en,Heat,"Obsessive master thief, Neil McCauley leads a top-notch crew on various insane heists throughout Los Angeles while a mentally unstable detective, Vincent Hanna pursues him without rest. Each man recognizes and respects the ability and the dedication of the other even though they are aware their cat-and-mouse game may end in violence.",17.924927,/umSVjVdbVwtx5ryCA2QXL44Durm.jpg,"[{'name': 'Regency Enterprises', 'id': 508}, {'name': 'Forward Pass', 'id': 675}, {'name': 'Warner Bros.', 'id': 6194}]","[{'iso_3166_1': 'US', 'name': 'United States of America'}]",1995-12-15,187436818,170.0,"[{'iso_639_1': 'en', 'name': 'English'}, {'iso_639_1': 'es', 'name': 'Español'}]",Released,A Los Angeles Crime Saga,Heat,False,7.7,1886,6,"[{'id': 642, 'name': 'robbery'}, {'id': 703, 'name': 'detective'}, {'id': 974, 'name': 'bank'}, {'id': 1523, 'name': 'obsession'}, {'id': 3713, 'name': 'chase'}, {'id': 7281, 'name': 'shooting'}, {'id': 9727, 'name': 'thief'}, {'id': 9812, 'name': 'honor'}, {'id': 9826, 'name': 'murder'}, {'id': 9937, 'name': 'suspense'}, {'id': 10051, 'name': 'heist'}, {'id': 10085, 'name': 'betrayal'}, {'id': 10594, 'name': 'money'}, {'id': 10726, 'name': 'gang'}, {'id': 15076, 'name': 'cat and mouse'}, {'id': 18023, 'name': 'criminal mastermind'}, {'id': 34117, 'name': 'cult film'}, {'id': 156121, 'name': 'ex-con'}, {'id': 159343, 'name': 'heist movie'}, {'id': 159434, 'name': 'one last job'}, {'id': 167104, 'name': 'loner'}, {'id': 192261, 'name': 'bank job'}, {'id': 207268, 'name': 'neo-noir'}, {'id': 208009, 'name': 'gun fight'}, {'id': 214983, 'name': 'crime epic'}]"
False,,58000000,"[{'id': 35, 'name': 'Comedy'}, {'id': 10749, 'name': 'Romance'}]",,11860,tt0114319,en,Sabrina,"An ugly duckling having undergone a remarkable change, still harbors feelings for her crush: a carefree playboy, but not before his business-focused brother has something to say about it.",6.677277,/z1oNjotUI7D06J4LWQFQzdIuPnf.jpg,"[{'name': 'Paramount Pictures', 'id': 4}, {'name': 'Scott Rudin Productions', 'id': 258}, {'name': 'Mirage Enterprises', 'id': 932}, {'name': 'Sandollar Productions', 'id': 5842}, {'name': 'Constellation Entertainment', 'id': 14941}, {'name': 'Worldwide', 'id': 55873}, {'name': 'Mont Blanc Entertainment GmbH', 'id': 58079}]","[{'iso_3166_1': 'DE', 'name': 'Germany'}, {'iso_3166_1': 'US', 'name': 'United States of America'}]",1995-12-15,0,127.0,"[{'iso_639_1': 'fr', 'name': 'Français'}, {'iso_639_1': 'en', 'name': 'English'}]",Released,You are cordially invited to the most surprising merger of the year.,Sabrina,False,6.2,141,7,"[{'id': 90, 'name': 'paris'}, {'id': 380, 'name': 'brother brother relationship'}, {'id': 2072, 'name': 'chauffeur'}, {'id': 9398, 'name': 'long island'}, {'id': 9492, 'name': 'fusion'}, {'id': 33626, 'name': 'millionaire'}]"
False,,0,"[{'id': 28, 'name': 'Action'}, {'id': 12, 'name': 'Adventure'}, {'id': 18, 'name': 'Drama'}, {'id': 10751, 'name': 'Family'}]",,45325,tt0112302,en,Tom and Huck,"A mischievous young boy, Tom Sawyer, witnesses a murder by the deadly Injun Joe. Tom becomes friends with Huckleberry Finn, a boy with no future and no family. Tom has to choose between honoring a friendship or honoring an oath because the town alcoholic is accused of the murder. Tom and Huck go through several adventures trying to retrieve evidence.",2.561161,/vIG8hWOa7DyLMRiurzKwVAnIYoU.jpg,"[{'name': 'Walt Disney Pictures', 'id': 2}]","[{'iso_3166_1': 'US', 'name': 'United States of America'}]",1995-12-22,0,97.0,"[{'iso_639_1': 'en', 'name': 'English'}, {'iso_639_1': 'de', 'name': 'Deutsch'}]",Released,The Original Bad Boys.,Tom and Huck,False,5.4,45,8,[]
False,,35000000,"[{'id': 28, 'name': 'Action'}, {'id': 12, 'name': 'Adventure'}, {'id': 53, 'name': 'Thriller'}]",,9091,tt0114576,en,Sudden Death,"International action superstar Jean Claude Van Damme teams with Powers Boothe in a Tension-packed, suspense thriller, set against the back-drop of a Stanley Cup game.Van Damme portrays a father whose daughter is suddenly taken during a championship hockey game. With the captors demanding a billion dollars by game's end, Van Damme frantically sets a plan in motion to rescue his daughter and abort an impending explosion before the final buzzer...",5.23158,/1pylO6YX5XdOA6QCc5IRxrrffkg.jpg,"[{'name': 'Universal Pictures', 'id': 33}, {'name': 'Imperial Entertainment', 'id': 21437}, {'name': 'Signature Entertainment', 'id': 23770}]","[{'iso_3166_1': 'US', 'name': 'United States of America'}]",1995-12-22,64350171,106.0,"[{'iso_639_1': 'en', 'name': 'English'}]",Released,Terror goes into overtime.,Sudden Death,False,5.5,174,9,"[{'id': 949, 'name': 'terrorist'}, {'id': 1562, 'name': 'hostage'}, {'id': 1653, 'name': 'explosive'}, {'id': 193533, 'name': 'vice president'}]"
False,"{'id': 645, 'name': 'James Bond Collection', 'poster_path': '/HORpg5CSkmeQlAolx3bKMrKgfi.jpg', 'backdrop_path': '/6VcVl48kNKvdXOZfJPdarlUGOsk.jpg'}",58000000,"[{'id': 12, 'name': 'Adventure'}, {'id': 28, 'name': 'Action'}, {'id': 53, 'name': 'Thriller'}]",http://www.mgm.com/view/movie/757/Goldeneye/,710,tt0113189,en,GoldenEye,James Bond must unmask the mysterious head of the Janus Syndicate and prevent the leader from utilizing the GoldenEye weapons system to inflict devastating revenge on Britain.,14.686036,/z0ljRnNxIO7CRBhLEO0DvLgAFPR.jpg,"[{'name': 'United Artists', 'id': 60}, {'name': 'Eon Productions', 'id': 7576}]","[{'iso_3166_1': 'GB', 'name': 'United Kingdom'}, {'iso_3166_1': 'US', 'name': 'United States of America'}]",1995-11-16,352194034,130.0,"[{'iso_639_1': 'en', 'name': 'English'}, {'iso_639_1': 'ru', 'name': 'Pусский'}, {'iso_639_1': 'es', 'name': 'Español'}]",Released,No limits. No fears. No substitutes.,GoldenEye,False,6.6,1194,10,"[{'id': 701, 'name': 'cuba'}, {'id': 769, 'name': 'falsely accused'}, {'id': 1308, 'name': 'secret identity'}, {'id': 2812, 'name': 'computer virus'}, {'id': 3268, 'name': 'secret base'}, {'id': 3272, 'name': 'secret intelligence service'}, {'id': 3278, 'name': 'kgb'}, {'id': 3376, 'name': 'satellite'}, {'id': 3531, 'name': 'special car'}, {'id': 3560, 'name': 'cossack'}, {'id': 3561, 'name': 'electromagnetic pulse'}, {'id': 3562, 'name': 'time bomb'}, {'id': 3563, 'name': 'st. petersburg russia'}, {'id': 3564, 'name': 'ejection seat'}, {'id': 193008, 'name': 'red army'}]"
False,,62000000,"[{'id': 35, 'name': 'Comedy'}, {'id': 18, 'name': 'Drama'}, {'id': 10749, 'name': 'Romance'}]",,9087,tt0112346,en,The American President,"Widowed U.S. president Andrew Shepherd, one of the world's most powerful men, can have anything he wants -- and what he covets most is Sydney Ellen Wade, a Washington lobbyist. But Shepherd's attempts at courting her spark wild rumors and decimate his approval ratings.",6.318445,/yObOAYFIHXHkFPQ3jhgkN2ezaD.jpg,"[{'name': 'Columbia Pictures', 'id': 5}, {'name': 'Castle Rock Entertainment', 'id': 97}]","[{'iso_3166_1': 'US', 'name': 'United States of America'}]",1995-11-17,107879496,106.0,"[{'iso_639_1': 'en', 'name': 'English'}]",Released,Why can't the most powerful man in the world have the one thing he wants most?,The American President,False,6.5,199,11,"[{'id': 833, 'name': 'white house'}, {'id': 840, 'name': 'usa president'}, {'id': 1605, 'name': 'new love'}, {'id': 33476, 'name': 'widower'}, {'id': 211505, 'name': 'wildlife conservation'}]"
False,,0,"[{'id': 35, 'name': 'Comedy'}, {'id': 27, 'name': 'Horror'}]",,12110,tt0112896,en,Dracula: Dead and Loving It,"When a lawyer shows up at the vampire's doorstep, he falls prey to his charms and joins him in his search for fresh blood. Enter Dr. van Helsing, who may be the only one able to vanquish the count.",5.430331,/4rRfZz8YnHNRr16t3CFcJrPdXHi.jpg,"[{'name': 'Columbia Pictures', 'id': 5}, {'name': 'Castle Rock Entertainment', 'id': 97}, {'name': 'Enigma Pictures', 'id': 6368}]","[{'iso_3166_1': 'FR', 'name': 'France'}, {'iso_3166_1': 'US', 'name': 'United States of America'}]",1995-12-22,0,88.0,"[{'iso_639_1': 'en', 'name': 'English'}, {'iso_639_1': 'de', 'name': 'Deutsch'}]",Released,,Dracula: Dead and Loving It,False,5.7,210,12,"[{'id': 3633, 'name': 'dracula'}, {'id': 11931, 'name': 'spoof'}]"
False,"{'id': 117693, 'name': 'Balto Collection', 'poster_path': '/w0ZgH6Lgxt2bQYnf1ss74UvYftm.jpg', 'backdrop_path': '/9VM5LiJV0bGb1st1KyHA3cVnO2G.jpg'}",0,"[{'id': 10751, 'name': 'Family'}, {'id': 16, 'name': 'Animation'}, {'id': 12, 'name': 'Adventure'}]",,21032,tt0112453,en,Balto,"An outcast half-wolf risks his life to prevent a deadly epidemic from ravaging Nome, Alaska.",12.140733,/dCVcdb5oxDizqFLz0F7TE60NoC9.jpg,"[{'name': 'Universal Pictures', 'id': 33}, {'name': 'Amblin Entertainment', 'id': 56}, {'name': 'Amblimation', 'id': 4105}]","[{'iso_3166_1': 'US', 'name': 'United States of America'}]",1995-12-22,11348324,78.0,"[{'iso_639_1': 'en', 'name': 'English'}]",Released,Part Dog. Part Wolf. All Hero.,Balto,False,7.1,423,13,"[{'id': 1994, 'name': 'wolf'}, {'id': 6411, 'name': 'dog-sledding race'}, {'id': 9880, 'name': 'alaska'}, {'id': 15162, 'name': 'dog'}, {'id': 15169, 'name': 'goose'}, {'id': 158175, 'name': 'bear attack'}, {'id': 158370, 'name': 'dog sled'}, {'id': 158371, 'name': 'frozen lake'}]"
False,,44000000,"[{'id': 36, 'name': 'History'}, {'id': 18, 'name': 'Drama'}]",,10858,tt0113987,en,Nixon,"An all-star cast powers this epic look at American President Richard M. Nixon, a man carrying the fate of the world on his shoulders while battling the self-destructive demands within. Spanning his troubled boyhood in California to the shocking Watergate scandal that would end his presidency.",5.092,/cz2MTGr2wpDZLirgV2rGHBdA2t3.jpg,"[{'name': 'Hollywood Pictures', 'id': 915}, {'name': 'Cinergi Pictures Entertainment', 'id': 1504}]","[{'iso_3166_1': 'US', 'name': 'United States of America'}]",1995-12-22,13681765,192.0,"[{'iso_639_1': 'en', 'name': 'English'}]",Released,"Triumphant in Victory, Bitter in Defeat. He Changed the World, But Lost a Nation.",Nixon,False,7.1,72,14,"[{'id': 840, 'name': 'usa president'}, {'id': 2946, 'name': 'presidential election'}, {'id': 4240, 'name': 'watergate scandal'}, {'id': 5565, 'name': 'biography'}, {'id': 6086, 'name': 'government'}, {'id': 6165, 'name': 'historical figure'}]"
False,,98000000,"[{'id': 28, 'name': 'Action'}, {'id': 12, 'name': 'Adventure'}]",,1408,tt0112760,en,Cutthroat Island,"Morgan Adams and her slave, William Shaw, are on a quest to recover the three portions of a treasure map. Unfortunately, the final portion is held by her murderous uncle, Dawg. Her crew is skeptical of her leadership abilities, so she must complete her quest before they mutiny against her. This is made yet more difficult by the efforts of the British crown to end her pirate raids.",7.284477,/hYdeBZ4BFXivdouxLfQGWNE6zRx.jpg,"[{'name': 'Le Studio Canal+', 'id': 183}, {'name': 'Laurence Mark Productions', 'id': 415}, {'name': 'Metro-Goldwyn-Mayer (MGM)', 'id': 8411}, {'name': 'Carolco Pictures', 'id': 14723}]","[{'iso_3166_1': 'FR', 'name': 'France'}, {'iso_3166_1': 'DE', 'name': 'Germany'}, {'iso_3166_1': 'IT', 'name': 'Italy'}, {'iso_3166_1': 'US', 'name': 'United States of America'}]",1995-12-22,10017322,119.0,"[{'iso_639_1': 'en', 'name': 'English'}, {'iso_639_1': 'la', 'name': 'Latin'}]",Released,The Course Has Been Set. There Is No Turning Back. Prepare Your Weapons. Summon Your Courage. Discover the Adventure of a Lifetime!,Cutthroat Island,False,5.7,137,15,"[{'id': 911, 'name': 'exotic island'}, {'id': 1454, 'name': 'treasure'}, {'id': 1969, 'name': 'map'}, {'id': 3799, 'name': 'ship'}, {'id': 5470, 'name': 'scalp'}, {'id': 12988, 'name': 'pirate'}]"
False,,52000000,"[{'id': 18, 'name': 'Drama'}, {'id': 80, 'name': 'Crime'}]",,524,tt0112641,en,Casino,The life of the gambling paradise – Las Vegas – and its dark mafia underbelly.,10.137389,/4TS5O1IP42bY2BvgMxL156EENy.jpg,"[{'name': 'Universal Pictures', 'id': 33}, {'name': 'Légende Entreprises', 'id': 10898}, {'name': 'Syalis DA', 'id': 11583}, {'name': 'De Fina-Cappa', 'id': 11584}]","[{'iso_3166_1': 'FR', 'name': 'France'}, {'iso_3166_1': 'US', 'name': 'United States of America'}]",1995-11-22,116112375,178.0,"[{'iso_639_1': 'en', 'name': 'English'}]",Released,No one stays at the top forever.,Casino,False,7.8,1343,16,"[{'id': 383, 'name': 'poker'}, {'id': 726, 'name': 'drug abuse'}, {'id': 1228, 'name': '1970s'}, {'id': 2635, 'name': 'overdose'}, {'id': 33625, 'name': 'illegal prostitution'}]"
False,,16500000,"[{'id': 18, 'name': 'Drama'}, {'id': 10749, 'name': 'Romance'}]",,4584,tt0114388,en,Sense and Sensibility,"Rich Mr. Dashwood dies, leaving his second wife and her daughters poor by the rules of inheritance. Two daughters are the titular opposites.",10.673167,/cBK2yL3HqhFvIVd7lLtazWlRZPR.jpg,"[{'name': 'Columbia Pictures Corporation', 'id': 441}, {'name': 'Mirage Enterprises', 'id': 932}]","[{'iso_3166_1': 'GB', 'name': 'United Kingdom'}, {'iso_3166_1': 'US', 'name': 'United States of America'}]",1995-12-13,135000000,136.0,"[{'iso_639_1': 'en', 'name': 'English'}]",Released,Lose your heart and come to your senses.,Sense and Sensibility,False,7.2,364,17,"[{'id': 420, 'name': 'bowling'}, {'id': 818, 'name': 'based on novel'}, {'id': 964, 'name': 'servant'}, {'id': 2755, 'name': 'country life'}, {'id': 7564, 'name': 'jane austen'}, {'id': 10911, 'name': 'inheritance'}, {'id': 11109, 'name': 'military officer'}, {'id': 15060, 'name': 'period drama'}, {'id': 156507, 'name': 'rainstorm'}, {'id': 156510, 'name': 'horse and carriage'}, {'id': 156512, 'name': 'decorum'}]"
False,,4000000,"[{'id': 80, 'name': 'Crime'}, {'id': 35, 'name': 'Comedy'}]",,5,tt0113101,en,Four Rooms,It's Ted the Bellhop's first night on the job...and the hotel's very unusual guests are about to place him in some outrageous predicaments. It seems that this evening's room service is serving up one unbelievable happening after another.,9.026586,/75aHn1NOYXh4M7L5shoeQ6NGykP.jpg,"[{'name': 'Miramax Films', 'id': 14}, {'name': 'A Band Apart', 'id': 59}]","[{'iso_3166_1': 'US', 'name': 'United States of America'}]",1995-12-09,4300000,98.0,"[{'iso_639_1': 'en', 'name': 'English'}]",Released,"Twelve outrageous guests. Four scandalous requests. And one lone bellhop, in his first day on the job, who's in for the wildest New year's Eve of his life.",Four Rooms,False,6.5,539,18,"[{'id': 612, 'name': 'hotel'}, {'id': 613, 'name': ""new year's eve""}, {'id': 616, 'name': 'witch'}, {'id': 622, 'name': 'bet'}, {'id': 922, 'name': 'hotel room'}, {'id': 2700, 'name': 'sperm'}, {'id': 12670, 'name': 'los angeles'}, {'id': 160488, 'name': 'hoodlum'}, {'id': 187056, 'name': 'woman director'}, {'id': 198129, 'name': 'episode film'}]"
False,"{'id': 3167, 'name': 'Ace Ventura Collection', 'poster_path': '/qCxH543pScFed1CycwJ1nVgrkOc.jpg', 'backdrop_path': '/bswWgdDsLu0fhWMYUzLF8XgiK4h.jpg'}",30000000,"[{'id': 80, 'name': 'Crime'}, {'id': 35, 'name': 'Comedy'}, {'id': 12, 'name': 'Adventure'}]",,9273,tt0112281,en,Ace Ventura: When Nature Calls,"Summoned from an ashram in Tibet, Ace finds himself on a perilous journey into the jungles of Africa to find Shikaka, the missing sacred animal of the friendly Wachati tribe. He must accomplish this before the wedding of the Wachati's Princess to the prince of the warrior Wachootoos. If Ace fails, the result will be a vicious tribal war.",8.205448,/wcinCf1ov2D6M3P7BBZkzQFOiIb.jpg,"[{'name': 'O Entertainment', 'id': 5682}, {'name': 'Warner Bros.', 'id': 6194}, {'name': 'Morgan Creek Productions', 'id': 10210}]","[{'iso_3166_1': 'US', 'name': 'United States of America'}]",1995-11-10,212385533,90.0,"[{'iso_639_1': 'en', 'name': 'English'}]",Released,New animals. New adventures. Same hair.,Ace Ventura: When Nature Calls,False,6.1,1128,19,"[{'id': 409, 'name': 'africa'}, {'id': 1551, 'name': 'indigenous'}, {'id': 2526, 'name': 'human animal relationship'}, {'id': 5155, 'name': 'bat'}]"
False,,60000000,"[{'id': 28, 'name': 'Action'}, {'id': 35, 'name': 'Comedy'}, {'id': 80, 'name': 'Crime'}]",,11517,tt0113845,en,Money Train,"A vengeful New York transit cop decides to steal a trainload of subway fares; his foster brother, a fellow cop, tries to protect him.",7.337906,/jWBDz6Mf9aQVBiUS76JQsEhvoJl.jpg,"[{'name': 'Columbia Pictures', 'id': 5}]","[{'iso_3166_1': 'US', 'name': 'United States of America'}]",1995-11-21,35431113,103.0,"[{'iso_639_1': 'en', 'name': 'English'}]",Released,"Get on, or GET OUT THE WAY!",Money Train,False,5.4,224,20,"[{'id': 380, 'name': 'brother brother relationship'}, {'id': 1552, 'name': 'subway'}, {'id': 14512, 'name': 'new york city'}, {'id': 155735, 'name': 'new york subway'}, {'id': 156120, 'name': 'train robbery'}]"
False,"{'id': 91698, 'name': 'Chili Palmer Collection', 'poster_path': '/ae3smJDdWrMJ77tDpYOrpo4frKq.jpg', 'backdrop_path': '/uWaANGQeoSs5vSP1CWtlkDrkqei.jpg'}",30250000,"[{'id': 35, 'name': 'Comedy'}, {'id': 53, 'name': 'Thriller'}, {'id': 80, 'name': 'Crime'}]",,8012,tt0113161,en,Get Shorty,"Chili Palmer is a Miami mobster who gets sent by his boss, the psychopathic ""Bones"" Barboni, to collect a bad debt from Harry Zimm, a Hollywood producer who specializes in cheesy horror films. When Chili meets Harry's leading lady, the romantic sparks fly. After pitching his own life story as a movie idea, Chili learns that being a mobster and being a Hollywood producer really aren't all that different.",12.669608,/r82SdPhg4fnIcLt0ogIjQxqjdcO.jpg,"[{'name': 'Jersey Films', 'id': 216}, {'name': 'Metro-Goldwyn-Mayer (MGM)', 'id': 8411}]","[{'iso_3166_1': 'US', 'name': 'United States of America'}]",1995-10-20,115101622,105.0,"[{'iso_639_1': 'en', 'name': 'English'}]",Released,"The mob is tough, but it’s nothing like show business.",Get Shorty,False,6.4,305,21,"[{'id': 395, 'name': 'gambling'}, {'id': 416, 'name': 'miami'}, {'id': 818, 'name': 'based on novel'}, {'id': 8438, 'name': 'job'}, {'id': 9826, 'name': 'murder'}, {'id': 9935, 'name': 'travel'}, {'id': 10391, 'name': 'mafia'}, {'id': 10594, 'name': 'money'}, {'id': 11061, 'name': 'debt'}, {'id': 11578, 'name': 'mobster'}, {'id': 12094, 'name': 'business'}, {'id': 12396, 'name': 'hollywood'}, {'id': 13142, 'name': 'gangster'}, {'id': 14536, 'name': 'crime'}, {'id': 14819, 'name': 'violence'}, {'id': 14964, 'name': 'drug'}, {'id': 33879, 'name': 'producer'}, {'id': 159608, 'name': 'con'}]"
False,,0,"[{'id': 18, 'name': 'Drama'}, {'id': 53, 'name': 'Thriller'}]",,1710,tt0112722,en,Copycat,An agoraphobic psychologist and a female detective must work together to take down a serial killer who copies serial killers from the past.,10.701801,/oMgwJb016znNZcpDR20eXxZoW8A.jpg,"[{'name': 'Regency Enterprises', 'id': 508}, {'name': 'New Regency Pictures', 'id': 10104}]","[{'iso_3166_1': 'US', 'name': 'United States of America'}]",1995-10-27,0,124.0,"[{'iso_639_1': 'en', 'name': 'English'}, {'iso_639_1': 'de', 'name': 'Deutsch'}]",Released,"One man is copying the most notorious killers in history one at a time. Together, two women must stop him from killing again. Or they're next.",Copycat,False,6.5,199,22,"[{'id': 796, 'name': 'police brutality'}, {'id': 2800, 'name': 'psychology'}, {'id': 4668, 'name': 'police operation'}, {'id': 5430, 'name': 'police protection'}, {'id': 10714, 'name': 'serial killer'}, {'id': 11268, 'name': 'psychologist'}, {'id': 13001, 'name': 'cowardliness'}]"
