adult,belongs_to_collection,budget,genres,homepage,id,imdb_id,original_language,original_title,overview,popularity,poster_path,production_companies,production_countries,release_date,revenue,runtime,spoken_languages,status,tagline,title,video,vote_average,vote_count,new_id,keywords
False,,0,"[{'id': 18, 'name': 'Drama'}]",,71754,tt0113774,en,Margaret's Museum,"In a town where half the men die down the coalpit, Margaret MacNeil is quite happy being single in her small Cape Breton island town. Until she meets Neil Currie, a charming and sincere bagpipe-playing, Gaelic-speaking dishwasher. But no matter what you do, you can't avoid the spectre of the pit forever.",0.372697,/ulhih7Th6S9zuhR5kOiVdCm8Il4.jpg,"[{'name': 'Téléfilm Canada', 'id': 806}, {'name': 'Skyline Films', 'id': 2055}, {'name': 'Malofilm', 'id': 3498}, {'name': 'Société de Développement des Entreprises Culturelles (SODEC)', 'id': 9116}, {'name': 'British Screen Productions', 'id': 12745}, {'name': 'National Film Board of Canada (NFB)', 'id': 17027}, {'name': 'imX Communications', 'id': 22150}, {'name': 'Glace Bay Pictures', 'id': 38673}, {'name': 'Ciné Télé Action', 'id': 38674}, {'name': 'Nova Scotia Film Development Corporation', 'id': 40534}, {'name': 'Ranfilm', 'id': 85045}]","[{'iso_3166_1': 'CA', 'name': 'Canada'}, {'iso_3166_1': 'GB', 'name': 'United Kingdom'}]",1995-09-13,0,114.0,"[{'iso_639_1': 'en', 'name': 'English'}]",Released,She found a way to preserve her memories forever.,Margaret's Museum,False,7.5,2,113,"[{'id': 6015, 'name': 'mining'}, {'id': 40897, 'name': 'dance lesson'}, {'id': 164742, 'name': 'coal mining'}, {'id': 188645, 'name': 'bagpipes'}]"
False,,13365000,"[{'id': 35, 'name': 'Comedy'}]",,43612,tt0112556,en,Le Bonheur est dans le pré,"Francis, the boss of a small plumbing supply company, is harassed by tax collectors, striking employees, and an impossible wife and daughter. His only joy is sharing lunch with his friend Gerard. Then a TV show called ""where are you?"" shows a woman from Gers who is searching for her husband who disappeared 28 years ago. The lost husband looks like an identical twin of Francis...",1.254885,/tjHn19RpFMBmzQx58SBO40nLvhu.jpg,"[{'name': 'France 2 Cinéma', 'id': 83}, {'name': 'France 3 Cinéma', 'id': 591}, {'name': 'StudioCanal', 'id': 694}, {'name': 'Les Productions du Champ Poirier', 'id': 883}, {'name': 'Téléma Productions', 'id': 885}]","[{'iso_3166_1': 'FR', 'name': 'France'}]",1995-01-31,0,106.0,"[{'iso_639_1': 'fr', 'name': 'Français'}]",Released,,Happiness Is in the Field,False,7.0,23,114,"[{'id': 12392, 'name': 'best friend'}, {'id': 15016, 'name': 'twins'}, {'id': 17953, 'name': 'country'}, {'id': 177035, 'name': 'identity swap'}, {'id': 187056, 'name': 'woman director'}]"
False,,0,"[{'id': 99, 'name': 'Documentary'}, {'id': 18, 'name': 'Drama'}, {'id': 10769, 'name': 'Foreign'}]",http://www.sonypictures.com/classics/annefrank/index.html,51352,tt0112373,en,Anne Frank Remembered,"Using previously unreleased archival material in addition to contemporary interviews, this academy award-winning documentary tells the story of the Frank family and presents the first fully-rounded portrait of their brash and free-spirited daughter Anne, perhaps the world's most famous victim of the Holocaust. Written by Dawn M. Barclift",0.243986,/6nyhzrSGimCbdxiY8DEO7kI7xx4.jpg,[],"[{'iso_3166_1': 'GB', 'name': 'United Kingdom'}, {'iso_3166_1': 'US', 'name': 'United States of America'}, {'iso_3166_1': 'NL', 'name': 'Netherlands'}]",1995-06-08,1,117.0,"[{'iso_639_1': 'en', 'name': 'English'}]",Released,"She is perhaps Hitler's best known victim, but what was Anne Frank really like?",Anne Frank Remembered,False,7.3,4,115,"[{'id': 1755, 'name': 'fascism'}, {'id': 2450, 'name': 'auschwitz'}, {'id': 4020, 'name': 'typhus'}, {'id': 4399, 'name': 'victim'}, {'id': 4434, 'name': 'interview'}, {'id': 10360, 'name': 'prejudice'}, {'id': 11728, 'name': 'burglary'}, {'id': 15199, 'name': 'rabbit'}]"
False,,0,"[{'id': 35, 'name': 'Comedy'}, {'id': 80, 'name': 'Crime'}, {'id': 18, 'name': 'Drama'}]",,16934,tt0115033,en,The Young Poisoner's Handbook,"A sinister tale of genius gone wrong, The Young Poisoner's Handbook chronicles a young man's descent into madness against the absurd backdrop of suburban English life. Hugh O'Conor plays Graham Young, a schoolboy from the London suburbs whose deadly obsession with toxic substances causes him to dabble in experimental murder.",6.178497,/d3Lakfy0K1eRHUbay9kMeWdt7y6.jpg,"[{'name': 'Bavaria Film and Television Fund', 'id': 3236}]","[{'iso_3166_1': 'DE', 'name': 'Germany'}, {'iso_3166_1': 'FR', 'name': 'France'}, {'iso_3166_1': 'GB', 'name': 'United Kingdom'}]",1995-01-20,0,99.0,"[{'iso_639_1': 'en', 'name': 'English'}]",Released,,The Young Poisoner's Handbook,False,6.9,19,116,"[{'id': 212, 'name': 'london england'}, {'id': 351, 'name': 'poison'}, {'id': 9672, 'name': 'based on true story'}, {'id': 9826, 'name': 'murder'}, {'id': 10714, 'name': 'serial killer'}, {'id': 11857, 'name': 'mental institution'}, {'id': 13130, 'name': 'teenager'}, {'id': 15106, 'name': 'psychiatrist'}, {'id': 232550, 'name': 'stepmother'}, {'id': 234682, 'name': 'social misfit'}]"
False,,0,"[{'id': 35, 'name': 'Comedy'}, {'id': 10749, 'name': 'Romance'}]",,10324,tt0116606,en,If Lucy Fell,"Joe and Lucy are roommates and best friends. Lucy, whose love life is embarrassingly dull, convinces Joe, who is infatuated with a neighbor he's never met, that if they don't have stable romances within a month, they must jump off the Brooklyn Bridge.",2.891918,/ig5LhLEnlt7QCyYjgui082fO4ih.jpg,"[{'name': 'TriStar Pictures', 'id': 559}, {'name': 'Motion Picture Corporation of America (MPCA)', 'id': 11061}]","[{'iso_3166_1': 'US', 'name': 'United States of America'}]",1996-03-08,0,92.0,"[{'iso_639_1': 'en', 'name': 'English'}]",Released,A comedy for the romantically challenged.,If Lucy Fell,False,5.4,11,117,"[{'id': 1253, 'name': 'roommate'}, {'id': 9457, 'name': 'single'}, {'id': 9673, 'name': 'love'}, {'id': 10183, 'name': 'independent film'}, {'id': 12392, 'name': 'best friend'}, {'id': 158967, 'name': 'brooklyn bridge'}]"
False,,25000000,"[{'id': 35, 'name': 'Comedy'}, {'id': 18, 'name': 'Drama'}]",,78406,tt0114536,en,Steal Big Steal Little,"Ruben and Robby are twin brothers, adopted by Mona, one of the wealthiest - and most eccentric - women in Santa Barbara. Ruben is devoted to Mona, but Robby is more devoted to her money. So when Mona leaves her fortune and estate to Ruben it starts a battle between brothers that soon leads to madness, mayhem, and even attempted murder. On Ruben's side is Lou Perilli an ex-Chicago cop and used car dealer who knows the law - and how to get around it. On Robby's side is ruthless businessman Reed Tyler, who is out to turn a swift profit on Mona's property. Walking a shifty line between them is Eddie Agopian, the family lawyer, who doesn't care which side wins as long as he's on the winner's side. But whether they're stealing big or stealing little, they're all stealing in this hilarious comedy about greed, power... and brotherly love.",1.522412,/83TvBaWt8wZHUZo8MKwE2cLRBiT.jpg,"[{'name': 'Savoy Pictures', 'id': 11308}]","[{'iso_3166_1': 'US', 'name': 'United States of America'}]",1995-09-29,6278139,113.0,"[{'iso_639_1': 'en', 'name': 'English'}]",Released,Two brothers. One fortune. Zero chance they'll share it.,Steal Big Steal Little,False,5.1,7,118,"[{'id': 380, 'name': 'brother brother relationship'}, {'id': 7375, 'name': 'twin brother'}, {'id': 10909, 'name': 'lawyer'}, {'id': 155881, 'name': 'estate'}, {'id': 208563, 'name': 'santa barbara california'}]"
False,,0,"[{'id': 28, 'name': 'Action'}, {'id': 12, 'name': 'Adventure'}, {'id': 35, 'name': 'Comedy'}, {'id': 18, 'name': 'Drama'}, {'id': 10751, 'name': 'Family'}]",,55731,tt0117427,en,Race the Sun,"A bunch of high school misfits in Hawaii, introduced by their new teacher, attend a science fair in which they draw up inspiration to build their own solar car and win a trip to compete in the 1990 World Solar Challenge in Australia.",1.317878,/jQA7TXgmEi35Zab6fHQ8VZ7Zhfn.jpg,"[{'name': 'TriStar Pictures', 'id': 559}]","[{'iso_3166_1': 'US', 'name': 'United States of America'}]",1996-03-22,0,100.0,"[{'iso_639_1': 'en', 'name': 'English'}]",Released,A dream can make all the difference under the sun.,Race the Sun,False,5.2,21,119,"[{'id': 1668, 'name': 'hawaii'}, {'id': 5657, 'name': 'australia'}, {'id': 10508, 'name': 'teacher'}, {'id': 33885, 'name': 'car'}, {'id': 175976, 'name': 'solar power'}]"
False,,0,"[{'id': 18, 'name': 'Drama'}]",,32119,tt0106473,en,The Boys of St. Vincent,The true story of boys being sexually abused at their orphanage ran by a religious community in Newfoundland.,0.86539,/cam0cG0UWdUVtQRvFHJXmNtL1hY.jpg,[],"[{'iso_3166_1': 'CA', 'name': 'Canada'}]",1992-12-06,0,90.0,"[{'iso_639_1': 'en', 'name': 'English'}]",Released,,The Boys of St. Vincent,False,7.0,7,120,[]
False,,40000000,"[{'id': 35, 'name': 'Comedy'}, {'id': 10749, 'name': 'Romance'}]",,11066,tt0103859,en,Boomerang,"Marcus is a successful advertising executive who woos and beds women almost at will. After a company merger he finds that his new boss, the ravishing Jacqueline, is treating him in exactly the same way. Completely traumatised by this, his work goes badly downhill.",6.506983,/cc9YAZq5NXiIEJsHjW7p2FaHQkp.jpg,"[{'name': 'Paramount Pictures', 'id': 4}]","[{'iso_3166_1': 'US', 'name': 'United States of America'}]",1992-06-30,70100000,117.0,"[{'iso_639_1': 'fr', 'name': 'Français'}, {'iso_639_1': 'en', 'name': 'English'}]",Released,A Player Who's About to be Played.,Boomerang,False,5.4,139,121,"[{'id': 2273, 'name': 'role of women'}, {'id': 2336, 'name': 'ladykiller'}, {'id': 3836, 'name': 'success'}, {'id': 6779, 'name': ""ladies' man""}, {'id': 7769, 'name': 'chefin'}, {'id': 8642, 'name': 'casanova'}, {'id': 9094, 'name': 'womanizer'}]"
False,,0,"[{'id': 18, 'name': 'Drama'}, {'id': 35, 'name': 'Comedy'}, {'id': 10749, 'name': 'Romance'}]",,11104,tt0109424,cn,重慶森林,"Every day, Cop 223 buys a can of pineapple with an expiration date of May 1, symbolizing the day he'll get over his lost love. He's also got his eye on a mysterious woman in a blond wig, oblivious of the fact she's a drug dealer. Cop 663 is distraught with heartbreak over a breakup. But when his ex drops a spare set of his keys at a local cafe, a waitress lets herself into his apartment and spruces up his life.",6.778979,/43I9DcNoCzpyzK8JCkJYpHqHqGG.jpg,"[{'name': 'Jet Tone Production', 'id': 540}, {'name': 'The Criterion Collection', 'id': 10932}]","[{'iso_3166_1': 'HK', 'name': 'Hong Kong'}]",1994-07-14,0,102.0,"[{'iso_639_1': 'cn', 'name': '广州话 / 廣州話'}, {'iso_639_1': 'en', 'name': 'English'}, {'iso_639_1': 'ja', 'name': '日本語'}, {'iso_639_1': 'zh', 'name': '普通话'}]",Released,What a difference a day makes,Chungking Express,False,7.9,249,122,"[{'id': 1595, 'name': 'ex-girlfriend'}, {'id': 3391, 'name': 'drug smuggle'}, {'id': 5490, 'name': 'girlfriend'}, {'id': 6618, 'name': 'snack bar'}, {'id': 9840, 'name': 'romance'}, {'id': 12354, 'name': 'hong kong'}, {'id': 180294, 'name': 'pineapple'}, {'id': 185265, 'name': 'expiration date'}, {'id': 185266, 'name': 'flight attendant'}]"
False,,0,"[{'id': 18, 'name': 'Drama'}, {'id': 10749, 'name': 'Romance'}]",,37975,tt0114808,it,L'uomo delle stelle,The adventures and deceptions of a photographer who travels through the small villages of Sicily pretending that he is working for the big film studios in Rome.,1.702639,/wousyAPimHw7RQVjlvzA8BSr2pt.jpg,"[{'name': 'Cecchi Gori Group Tiger Cinematografica', 'id': 371}]","[{'iso_3166_1': 'IT', 'name': 'Italy'}]",1995-09-21,0,113.0,"[{'iso_639_1': 'it', 'name': 'Italiano'}]",Released,"In the golden age of cinema, everyone dreams of becoming a star. One man promises to make all their dreams come true...",The Star Maker,False,6.8,29,123,[]
False,,7000000,"[{'id': 35, 'name': 'Comedy'}, {'id': 10749, 'name': 'Romance'}]",,2074,tt0116324,en,Flirting with Disaster,"Adopted as a child, new father Mel Colpin (Ben Stiller) decides he cannot name his son until he knows his birth parents, and determines to make a cross-country quest to find them. Accompanied by his wife, Nancy (Patricia Arquette), and an inept yet gorgeous adoption agent, Tina (Tea Leoni), he departs on an epic road trip that quickly devolves into a farce of mistaken identities, wrong turns, and overzealous and love-struck ATF agents (Josh Brolin, Richard Jenkins).",5.579088,/sRRdVLuxk8OLCDRd4u4xDrDdwv7.jpg,"[{'name': 'Miramax Films', 'id': 14}]","[{'iso_3166_1': 'US', 'name': 'United States of America'}]",1996-03-22,14702438,92.0,"[{'iso_639_1': 'en', 'name': 'English'}]",Released,"A comedy about sex, love, family and other accidents waiting to happen.",Flirting with Disaster,False,6.3,66,124,"[{'id': 5498, 'name': 'lsd'}, {'id': 6230, 'name': 'looking for  birth parents'}, {'id': 6231, 'name': 'half-brother'}, {'id': 10183, 'name': 'independent film'}]"
False,"{'id': 91430, 'name': 'The Neverending Story Collection', 'poster_path': '/tXuOhgEbXoba7vVIybzGlnycoNq.jpg', 'backdrop_path': '/2IqXJIR1i0f6Ngq3A6rjXhQNqFc.jpg'}",17000000,"[{'id': 14, 'name': 'Fantasy'}]",,27793,tt0110647,en,The NeverEnding Story III,A young boy must restore order when a group of bullies steal the magical book that acts as a portal between Earth and the imaginary world of Fantasia.,6.252377,/o75HHfr23sgeqIeUPwjKY0V9Ppi.jpg,"[{'name': 'Studio Babelsberg', 'id': 264}, {'name': 'Dieter Geissler Filmproduktion', 'id': 1766}, {'name': 'Cinevox Filmproduktion GmbH', 'id': 1979}, {'name': 'Warner Bros.', 'id': 6194}, {'name': 'Miramax', 'id': 53009}]","[{'iso_3166_1': 'DE', 'name': 'Germany'}, {'iso_3166_1': 'US', 'name': 'United States of America'}]",1994-10-26,0,95.0,"[{'iso_639_1': 'en', 'name': 'English'}]",Released,It's a brand new beginning in the adventure that never ends,The Neverending Story III: Escape from Fantasia,False,4.4,105,125,"[{'id': 334, 'name': 'flying'}, {'id': 2343, 'name': 'magic'}]"
False,,0,"[{'id': 18, 'name': 'Drama'}]",,44284,tt0111055,ar,صمت القصور,The death of a prince brings a young woman back to the palace where she was born into servitude. The lingering legacy of the harem is brought into light from behind frosted windows and velvet curtains.,0.406754,/c8QQRaI3k3LNUqYKmlKldhLpgYK.jpg,"[{'name': 'Canal Horizons', 'id': 22029}, {'name': 'Mat Films', 'id': 22618}, {'name': 'Cinétéléfilms', 'id': 71842}]","[{'iso_3166_1': 'TN', 'name': 'Tunisia'}, {'iso_3166_1': 'FR', 'name': 'France'}]",1994-09-30,0,116.0,"[{'iso_639_1': 'ar', 'name': 'العربية'}, {'iso_639_1': 'fr', 'name': 'Français'}]",Released,,The Silences of the Palace,False,4.3,3,126,"[{'id': 187056, 'name': 'woman director'}]"
False,,0,[],,290157,tt0110217,en,Jupiter's Wife,"Michel Negroponte, a documentary filmmaker, meets Maggie one day in Central Park. Maggie claims to be married to the god Jupiter and the daughter of actor Robert Ryan. Michel gets to know Maggie over the next couple of years, and attempts to use her often outlandish stories as clues to reconstruct her past. - Written by James Meek",0.001178,/2GIdaPLF7gYyXnlxGzTwV5fQGWy.jpg,[],[],1995-01-01,0,87.0,[],Released,A Haunting Real Life Mystery,Jupiter's Wife,False,0.0,0,127,[]
False,,0,"[{'id': 35, 'name': 'Comedy'}, {'id': 10749, 'name': 'Romance'}]",,110972,tt0114131,en,Pie in the Sky,Pie in the Sky is a 1996 American romantic comedy film about a young man obsessed with traffic gridlock who falls in love with an avant-garde dancer.,0.699066,/iZs2BzP1nbrcHCDX3QEHa3Nn0y4.jpg,[],[],1996-02-09,0,95.0,"[{'iso_639_1': 'en', 'name': 'English'}]",Released,The only thing that stands in the way of fate and true love is a little traffic.,Pie in the Sky,False,7.0,2,128,[]
False,,0,"[{'id': 35, 'name': 'Comedy'}, {'id': 18, 'name': 'Drama'}]",,32622,tt0112364,en,Angela,"A ten year old girl named Angela leads her six year old sister, Ellie, through various regimens of 'purification' in an attempt to rid themselves of their evil, which she believes to be the cause of their mother's mental illness. Precocious, to say the least, Angela has visions of Lucifer coming to take her and her sister away, and one of her remedies for this is for them to remain within a circle of their dolls and toys until they see a vision of the virgin Mary come to them. But such thinking can only lead to an ending befitting of her own mental state.",2.197439,/fhxU3jFzC2tlBgqFhB7NqO4qAFe.jpg,[],"[{'iso_3166_1': 'US', 'name': 'United States of America'}]",1995-01-01,0,99.0,"[{'iso_639_1': 'en', 'name': 'English'}]",Released,,Angela,False,5.6,9,129,"[{'id': 10183, 'name': 'independent film'}, {'id': 187056, 'name': 'woman director'}]"
False,,0,"[{'id': 18, 'name': 'Drama'}, {'id': 10749, 'name': 'Romance'}, {'id': 10752, 'name': 'War'}]",,73067,tt0113107,it,Frankie Starlight,The quirky story of a young boy's adventures growing up with his stunningly beautiful mother and the two very different men who love her.,0.637554,/6v3VxWhFsr2Qx8qIQkG4WL3f76X.jpg,"[{'name': 'Fine Line Features', 'id': 8}, {'name': 'Channel Four Films', 'id': 181}, {'name': 'Bórd Scannán na hÉireann', 'id': 1898}, {'name': 'Canal+', 'id': 5358}]","[{'iso_3166_1': 'GB', 'name': 'United Kingdom'}, {'iso_3166_1': 'US', 'name': 'United States of America'}, {'iso_3166_1': 'FR', 'name': 'France'}, {'iso_3166_1': 'IE', 'name': 'Ireland'}]",1995-11-22,0,101.0,"[{'iso_639_1': 'en', 'name': 'English'}]",Released,Sometimes the brightest star is the one that shines within.,Frankie Starlight,False,5.4,4,130,"[{'id': 5202, 'name': 'boy'}, {'id': 13028, 'name': 'writer'}, {'id': 14985, 'name': 'ireland'}, {'id': 187844, 'name': 'flashback'}, {'id': 208501, 'name': 'troop ship'}]"
False,,50000000,"[{'id': 28, 'name': 'Action'}, {'id': 53, 'name': 'Thriller'}, {'id': 9648, 'name': 'Mystery'}, {'id': 10749, 'name': 'Romance'}]",,11863,tt0113451,en,Jade,"Someone does a nasty hatchet job on a San Fransisco big noise and the Assistant D.A. takes charge of the investigation. Through a web of blackmail and prostitution involving the Governor, an old lover of the law man emerges as a prime suspect and he has to deal with his personal feelings as well as the case.",11.418917,/8KWiZKDYpAgh8n27lanvTuDquyX.jpg,"[{'name': 'Paramount Pictures', 'id': 4}]","[{'iso_3166_1': 'US', 'name': 'United States of America'}]",1995-10-13,9851610,95.0,"[{'iso_639_1': 'en', 'name': 'English'}]",Released,Some fantasies go too far.,Jade,False,5.1,45,131,"[{'id': 550, 'name': 'callgirl'}, {'id': 582, 'name': 'san francisco'}, {'id': 5340, 'name': 'investigation'}, {'id': 9826, 'name': 'murder'}]"
False,,0,"[{'id': 35, 'name': 'Comedy'}, {'id': 18, 'name': 'Drama'}, {'id': 10749, 'name': 'Romance'}]",,55475,tt0114015,es,Nueba Yol,"Balbuena is a genial illegal immigrant who makes his way to New York City to take a bite out of the Big Apple. But his hopes of finding a better life soon begin to fade as Balbuena encounters one obstacle after another in the hardscrabble, uncaring metropolis.",0.291021,/wXJImKBIFIanoZQsx0knEfthpq5.jpg,"[{'name': 'Cigua Films', 'id': 93488}, {'name': ""D'Pelicula"", 'id': 93489}]","[{'iso_3166_1': 'DO', 'name': 'Dominican Republic'}]",1995-08-16,0,102.0,"[{'iso_639_1': 'es', 'name': 'Español'}]",Released,,Nueba Yol,False,5.5,1,132,"[{'id': 242, 'name': 'new york'}, {'id': 1625, 'name': 'emigration'}, {'id': 190019, 'name': 'dominican republic'}]"
False,,0,"[{'id': 10402, 'name': 'Music'}, {'id': 99, 'name': 'Documentary'}]",,124636,tt0114500,en,Sonic Outlaws,"Within days after the release of Negativland's clever parody of U2 and Casey Kasem, recording industry giant Island Records descended upon the band with a battery of lawyers intent on erasing the piece from the history of rock music.  Craig ""Tribulation 99"" Baldwin follows this and other intellectual property controversies across the contemporary arts scene. Playful and ironic, his cut-and-paste collage-essay surveys the prospects for an ""electronic folk culture"" in the midst of an increasingly commodified corporate media landscape.",0.001838,/AnUjiKfCnxwgEVW9r4xXq09BhdL.jpg,[],"[{'iso_3166_1': 'US', 'name': 'United States of America'}]",1995-08-01,0,87.0,"[{'iso_639_1': 'en', 'name': 'English'}]",Released,,Sonic Outlaws,False,0.0,0,133,[]
False,,0,"[{'id': 35, 'name': 'Comedy'}]",,9101,tt0116130,en,Down Periscope,"Bumbling Navy lieutenant Tom Dodge has been given one last chance to clean up his record. But Admiral Graham, his nemesis, assigns Dodge to the Stingray, a submarine that can barely keep afloat. To add insult to injury, the Stingray is to be the enemy flagship in the upcoming war games … and to make matters even worse, Dodge's crew is a band of idiots even more incompetent that he is!",5.184977,/brleKcHsirTw7lFqcgUMOfgL2nl.jpg,"[{'name': 'Twentieth Century Fox Film Corporation', 'id': 306}]","[{'iso_3166_1': 'US', 'name': 'United States of America'}]",1996-03-01,0,92.0,"[{'iso_639_1': 'en', 'name': 'English'}]",Released,"A rusty sub. A rebel commander. A renegade crew. When destiny called, they should have hung up.",Down Periscope,False,5.6,110,134,"[{'id': 339, 'name': 'submarine'}, {'id': 4410, 'name': 'u.s. navy'}, {'id': 9789, 'name': 'misfit'}]"
False,,0,"[{'id': 99, 'name': 'Documentary'}]",,123360,tt0113125,en,From the Journals of Jean Seberg,"Mark Rappaport's creative bio-pic about actress Jean Seberg is presented in a first-person, autobiographical format (with Seberg played by Mary Beth Hurt). He seamlessly interweaves cinema, politics, American society and culture, and film theory to inform, entertain, and move the viewer. Seberg's many marriages, as well as her film roles, are discussed extensively. Her involvement with the Black Panther Movement and subsequent investigation by the FBI is covered. Notably, details of French New Wave cinema, Russian Expressionist (silent) films, and the careers of Jane Fonda, Vanessa Redgrave, and Clint Eastwood are also intensively examined. Much of the film is based on conjecture, but Rappaport encourages viewers to re-examine their ideas about women in film with this thought-provoking picture.",0.276401,/i434k0SSFhDav9lCxFQzD95EciY.jpg,"[{'name': 'Couch Potatoe Productions', 'id': 68229}]","[{'iso_3166_1': 'US', 'name': 'United States of America'}]",1995-09-08,0,97.0,"[{'iso_639_1': 'en', 'name': 'English'}]",Released,,From the Journals of Jean Seberg,False,6.5,2,135,"[{'id': 5565, 'name': 'biography'}]"
False,,0,"[{'id': 35, 'name': 'Comedy'}]",,5757,tt0113756,en,Man of the Year,"First-time director Dirk Shafer also penned this raucous ""mockumentary,"" a blend of fact and fiction that re-creates his 1992 reign as Playgirl magazine's Centerfold of the Year. When Shafer chooses to keep the fact that he's gay a secret from the magazine's editors, he finds himself living the ultimate lie -- and incapable of giving female readers what they really want. Will he succumb to his lover's pressures to come out of the closet?",0.540436,/jVO3Gvsdqe5C9Jr7cE1fSOtW2Op.jpg,[],"[{'iso_3166_1': 'US', 'name': 'United States of America'}]",1995-09-15,209935,86.0,"[{'iso_639_1': 'en', 'name': 'English'}]",Released,He as a centerfold who revealed everything ... but the truth.,Man of the Year,False,3.8,2,136,"[{'id': 10180, 'name': 'homosexuality'}, {'id': 10183, 'name': 'independent film'}, {'id': 11800, 'name': 'mockumentary'}]"
False,,0,"[{'id': 18, 'name': 'Drama'}]",,39428,tt0113952,en,The Neon Bible,"While on a train, a teenage boy thinks about his life and the flamboyant aunt whose friendship acted as an emotional shield from his troubled family. This film evokes the haunting quality of memory while creating a heartfelt portrait of a boy's life in a rural 1940s Southern town.",0.370342,/2DyeA45isq3jIRlwG6VgwV8KQq7.jpg,"[{'name': 'Channel Four Films', 'id': 181}, {'name': 'Academy', 'id': 38778}, {'name': 'Mayfair Films', 'id': 94477}, {'name': 'Iberoamerica Films', 'id': 94478}]","[{'iso_3166_1': 'GB', 'name': 'United Kingdom'}]",1995-08-23,0,91.0,"[{'iso_639_1': 'en', 'name': 'English'}]",Released,,The Neon Bible,False,7.2,5,137,"[{'id': 531, 'name': 'southern usa'}, {'id': 818, 'name': 'based on novel'}, {'id': 10229, 'name': 'singer'}, {'id': 207981, 'name': 'south'}]"
False,,0,[],,124639,tt0114618,en,Target,A subtle yet violent commentary on feudal lords.,0.001205,,[],[],1995-08-01,0,122.0,[],Released,,Target,False,0.0,0,138,[]
False,,60000000,"[{'id': 18, 'name': 'Drama'}, {'id': 10749, 'name': 'Romance'}]",,9302,tt0118055,en,Up Close & Personal,"Tally Atwater has a dream: to be a prime-time network newscaster. She pursues this dream with nothing but ambition, raw talent and a homemade demo tape. Warren Justice is a brilliant, hard edged, veteran newsman. He sees Tally has talent and becomes her mentor. Tally’s career takes a meteoric rise and she and Warren fall in love. The romance that results is as intense and revealing as television news itself. Yet, each breaking story, every videotaped crisis that brings them together, also threatens to drive them apart...",3.402749,/2yf1pCiQk6JMy4k5zxf39YXQxGB.jpg,"[{'name': 'Cinergi Pictures Entertainment', 'id': 1504}, {'name': 'Touchstone Pictures', 'id': 9195}]","[{'iso_3166_1': 'US', 'name': 'United States of America'}]",1996-03-01,0,119.0,"[{'iso_639_1': 'fr', 'name': 'Français'}]",Released,"Every Day we Have, is One More Than We Deserve.",Up Close & Personal,False,5.9,51,139,"[{'id': 238179, 'name': 'skab under tv'}, {'id': 238241, 'name': 'foran'}, {'id': 238242, 'name': 'nederste hylde'}]"
