adult,belongs_to_collection,budget,genres,homepage,id,imdb_id,original_language,original_title,overview,popularity,poster_path,production_companies,production_countries,release_date,revenue,runtime,spoken_languages,status,tagline,title,video,vote_average,vote_count,new_id,keywords
False,,8000000,"[{'id': 80, 'name': 'Crime'}, {'id': 18, 'name': 'Drama'}, {'id': 53, 'name': 'Thriller'}]",,10427,tt0105226,en,Red Rock West,"When a promised job for Texan Michael fails to materialise in Wyoming, Mike is mistaken by Wayne to be the hitman he hired to kill his unfaithful wife, Suzanne. Mike takes full advantage of the situation, collects the money and runs. During his getaway, things go wrong, and soon get worse when he runs into the real hitman, Lyle.",5.137903,/ewofUEqU3Gpr7WSgSz3TEVPIfBg.jpg,"[{'name': 'Propaganda Films', 'id': 278}, {'name': 'PolyGram Filmed Entertainment', 'id': 1382}]","[{'iso_3166_1': 'US', 'name': 'United States of America'}]",1993-07-08,2000000,98.0,"[{'iso_639_1': 'en', 'name': 'English'}]",Released,Where nothing is as it seems.,Red Rock West,False,6.4,71,369,"[{'id': 798, 'name': 'sheriff'}, {'id': 1016, 'name': 'wyoming'}, {'id': 2708, 'name': 'hitman'}, {'id': 10856, 'name': 'bag of money'}, {'id': 207268, 'name': 'neo-noir'}]"
False,"{'id': 167985, 'name': 'Richie Rich Collection', 'poster_path': None, 'backdrop_path': None}",40000000,"[{'id': 35, 'name': 'Comedy'}, {'id': 10751, 'name': 'Family'}]",,11011,tt0110989,en,Ri¢hie Ri¢h,"Billionaire heir Richie Rich has it all, including Reggie Jackson as a batting coach and Claudia Schiffer as a personal trainer -- but no playmates. What's more, scoundrel Laurence Van Dough is scheming to take over the family empire. Uh-oh! Enter faithful butler Cadbury to save the day.",6.595255,/qgGh5d0IHAZRlHIdFS3XWVygumR.jpg,"[{'name': 'Davis Entertainment', 'id': 1302}, {'name': 'Silver Pictures', 'id': 1885}, {'name': 'Warner Bros.', 'id': 6194}]","[{'iso_3166_1': 'US', 'name': 'United States of America'}]",1994-12-19,0,95.0,"[{'iso_639_1': 'en', 'name': 'English'}, {'iso_639_1': 'la', 'name': 'Latin'}]",Released,An adventure so big... even the world's richest kid can't afford to miss it!,Ri¢hie Ri¢h,False,5.4,426,370,"[{'id': 18035, 'name': 'family'}, {'id': 175668, 'name': 'life raft'}, {'id': 175670, 'name': 'private airplane'}, {'id': 175676, 'name': 'toothbrush'}, {'id': 175681, 'name': 'gluttony'}, {'id': 175683, 'name': 'magnifying glass'}, {'id': 175685, 'name': 'rubber boat'}]"
False,,0,"[{'id': 18, 'name': 'Drama'}]",,49803,tt0111054,en,Safe Passage,A mother with seven sons feels like she's losing control of her life and her family. But personal...,4.931565,/b0pcExU3UvqUoaRiYwrVEAYC2iL.jpg,"[{'name': 'New Line Cinema', 'id': 12}]","[{'iso_3166_1': 'US', 'name': 'United States of America'}]",1994-12-01,0,98.0,"[{'iso_639_1': 'en', 'name': 'English'}]",Released,Life's best journeys take you home,Safe Passage,False,4.9,7,371,"[{'id': 456, 'name': 'mother'}, {'id': 4424, 'name': 'pain'}, {'id': 6038, 'name': 'marriage'}, {'id': 10183, 'name': 'independent film'}, {'id': 208316, 'name': 'worrying'}]"
False,,45000000,"[{'id': 28, 'name': 'Action'}, {'id': 12, 'name': 'Adventure'}, {'id': 80, 'name': 'Crime'}, {'id': 53, 'name': 'Thriller'}]",,8987,tt0110997,en,The River Wild,"While on a family vacation,  rafting expert Gail takes on a pair of armed killers while navigating a spectacularly violent river.",10.511241,/wVgQ2T63ThjIsY4R0qoHXjyllql.jpg,"[{'name': 'Universal Pictures', 'id': 33}, {'name': 'David Foster Productions', 'id': 496}, {'name': 'Turman-Foster Company', 'id': 662}]","[{'iso_3166_1': 'US', 'name': 'United States of America'}]",1994-09-30,0,111.0,"[{'iso_639_1': 'en', 'name': 'English'}]",Released,The vacation is over,The River Wild,False,6.1,214,372,"[{'id': 1261, 'name': 'river'}, {'id': 1621, 'name': 'robber'}, {'id': 1680, 'name': 'boston'}, {'id': 2492, 'name': 'bank robber'}, {'id': 5809, 'name': 'marriage crisis'}, {'id': 7188, 'name': 'hostage-taking'}, {'id': 8158, 'name': 'rafting'}, {'id': 15009, 'name': 'criminal'}, {'id': 233153, 'name': 'white water rafting'}]"
False,"{'id': 43064, 'name': 'Speed Collection', 'poster_path': '/9poztwq7SXjEETRdWXcJsl58kxV.jpg', 'backdrop_path': '/75mSNcKIkfZSjXDgytC8UFe6vBl.jpg'}",30000000,"[{'id': 28, 'name': 'Action'}, {'id': 12, 'name': 'Adventure'}, {'id': 80, 'name': 'Crime'}]",,1637,tt0111257,en,Speed,"Los Angeles SWAT cop Jack Traven is up against bomb expert Howard Payne, who's after major ransom money. First it's a rigged elevator in a very tall building. Then it's a rigged bus--if it slows, it will blow, bad enough any day, but a nightmare in LA traffic. And that's still not the end.",10.859292,/82PkCE4R95KhHICUDF7G4Ly2z3l.jpg,"[{'name': 'Twentieth Century Fox Film Corporation', 'id': 306}]","[{'iso_3166_1': 'US', 'name': 'United States of America'}]",1994-06-09,350448145,116.0,"[{'iso_639_1': 'en', 'name': 'English'}]",Released,Get ready for rush hour,Speed,False,6.8,1814,373,"[{'id': 258, 'name': 'bomb'}, {'id': 822, 'name': 'airport'}, {'id': 992, 'name': 'bus'}, {'id': 2776, 'name': 'bus ride'}, {'id': 3306, 'name': 'highway'}, {'id': 157251, 'name': 'bomb planting'}]"
False,,0,"[{'id': 35, 'name': 'Comedy'}, {'id': 10749, 'name': 'Romance'}]",,15128,tt0111256,en,Speechless,A romantic comedy. Michael Keaton and Geena Davis are speechwriters for competing political campaigns. Witty and amusing for the political junkies amongst us.,2.334226,/bremBHwg2cAvFIGIRwlRtPMkgfL.jpg,"[{'name': 'Metro-Goldwyn-Mayer (MGM)', 'id': 8411}]","[{'iso_3166_1': 'US', 'name': 'United States of America'}]",1994-12-16,0,99.0,"[{'iso_639_1': 'en', 'name': 'English'}]",Released,There are two sides to every relationship... Don't trust either of them.,Speechless,False,5.5,24,374,"[{'id': 6078, 'name': 'politics'}, {'id': 9673, 'name': 'love'}, {'id': 208323, 'name': 'speech writer'}]"
False,"{'id': 170452, 'name': 'Timecop Collection', 'poster_path': '/7MzxlFFswI2OB7PifjnyMrrYke5.jpg', 'backdrop_path': '/mIqsp7AFmyTYjJ4N9qv3FhAUz60.jpg'}",27000000,"[{'id': 53, 'name': 'Thriller'}, {'id': 878, 'name': 'Science Fiction'}, {'id': 28, 'name': 'Action'}, {'id': 80, 'name': 'Crime'}]",,8831,tt0111438,en,Timecop,"An officer for a security agency that regulates time travel, must fend for his life against a shady politician who has a tie to his past.",8.907074,/bgxP6ws8ErBiarnb4S93vv0lkf4.jpg,"[{'name': 'Universal Pictures', 'id': 33}, {'name': 'Renaissance Pictures', 'id': 467}, {'name': 'Dark Horse Entertainment', 'id': 552}, {'name': 'Largo Entertainment', 'id': 1644}, {'name': 'Signature Pictures', 'id': 2982}, {'name': 'JVC Entertainment Networks', 'id': 4248}]","[{'iso_3166_1': 'JP', 'name': 'Japan'}, {'iso_3166_1': 'US', 'name': 'United States of America'}]",1994-09-15,101646581,99.0,"[{'iso_639_1': 'en', 'name': 'English'}]",Released,They killed his wife ten years ago. There's still time to save her. Murder is forever... until now.,Timecop,False,5.5,288,375,"[{'id': 779, 'name': 'martial arts'}, {'id': 4379, 'name': 'time travel'}, {'id': 10568, 'name': 'science fiction'}, {'id': 175629, 'name': 'alternative reality'}]"
False,,115000000,"[{'id': 28, 'name': 'Action'}, {'id': 53, 'name': 'Thriller'}]",,36955,tt0111503,en,True Lies,"Harry Tasker is a secret agent for the United States Government. For years, he has kept his job from his wife, but is forced to reveal his identity and try to stop nuclear terrorists when he and his wife are kidnapped by them.",11.396099,/pweFTnzzTfGK68woSVkiTgjLzWm.jpg,"[{'name': 'Twentieth Century Fox Film Corporation', 'id': 306}, {'name': 'Lightstorm Entertainment', 'id': 574}]","[{'iso_3166_1': 'US', 'name': 'United States of America'}]",1994-07-14,378882411,141.0,"[{'iso_639_1': 'en', 'name': 'English'}, {'iso_639_1': 'fr', 'name': 'Français'}, {'iso_639_1': 'ar', 'name': 'العربية'}, {'iso_639_1': 'de', 'name': 'Deutsch'}]",Released,"When he said I do, he never said what he did.",True Lies,False,6.8,1138,376,"[{'id': 470, 'name': 'spy'}, {'id': 949, 'name': 'terrorist'}, {'id': 1196, 'name': 'florida'}, {'id': 1419, 'name': 'gun'}, {'id': 1930, 'name': 'kidnapping'}, {'id': 2284, 'name': 'horseback riding'}, {'id': 3546, 'name': 'florida keys'}, {'id': 4289, 'name': 'secret agent'}, {'id': 161520, 'name': 'terrorist plot'}, {'id': 167444, 'name': 'top secret'}, {'id': 167451, 'name': 'woman with glasses'}, {'id': 167461, 'name': 'truth serum'}, {'id': 167466, 'name': 'mushroom cloud'}, {'id': 167467, 'name': 'jackhammer'}, {'id': 206958, 'name': 'special agent'}, {'id': 217421, 'name': 'key west'}]"
False,,0,"[{'id': 18, 'name': 'Drama'}, {'id': 10749, 'name': 'Romance'}]",,10449,tt0111693,en,When a Man Loves a Woman,"An airline pilot and his wife are forced to face the consequences of her alcoholism when her addictions threaten her life and their daughter's safety. While the woman enters detox, her husband must face the truth of his enabling behavior.",4.322544,/cA1uMNX3sdWAWfMZbsgm1VIJYSY.jpg,"[{'name': 'Touchstone Pictures', 'id': 9195}]","[{'iso_3166_1': 'US', 'name': 'United States of America'}]",1994-04-29,50021959,126.0,"[{'iso_639_1': 'en', 'name': 'English'}, {'iso_639_1': 'fr', 'name': 'Français'}, {'iso_639_1': 'vi', 'name': 'Tiếng Việt'}]",Released,Through the good times. Through the bad times. When a Man Loves a Woman it's for all times.,When a Man Loves a Woman,False,6.0,71,377,"[{'id': 1157, 'name': 'wife husband relationship'}, {'id': 1605, 'name': 'new love'}, {'id': 18035, 'name': 'family'}, {'id': 33457, 'name': 'alcoholic'}, {'id': 40952, 'name': 'therapy'}]"
False,,0,"[{'id': 14, 'name': 'Fantasy'}]",,10395,tt0111742,en,Wolf,Publisher Will Randall becomes a werewolf and has to fight to keep his job.,14.063845,/8ocZb9x6rN82i8ZzZ05j1vWKVOC.jpg,"[{'name': 'Columbia Pictures', 'id': 5}]","[{'iso_3166_1': 'US', 'name': 'United States of America'}]",1994-06-17,0,125.0,"[{'iso_639_1': 'en', 'name': 'English'}]",Released,The animal is out.,Wolf,False,6.0,221,378,"[{'id': 596, 'name': 'adultery'}, {'id': 2499, 'name': 'heal'}, {'id': 4197, 'name': 'bite'}, {'id': 12564, 'name': 'werewolf'}]"
False,,63000000,"[{'id': 18, 'name': 'Drama'}, {'id': 28, 'name': 'Action'}, {'id': 37, 'name': 'Western'}]",,12160,tt0111756,en,Wyatt Earp,"Covering the life and times of one of the West's most iconic heroes Wyatt Earp weaves an intricate tale of Earp and his friends and family. With a star studded cast, sweeping cinematography and authentic costumes Wyatt Earp led the way during the Western revival in the 90's.",9.277147,/51LItgyecu2KMAtIchYogEykCIu.jpg,"[{'name': 'Tig Productions', 'id': 335}, {'name': 'Warner Bros.', 'id': 6194}, {'name': 'Kasdan Pictures', 'id': 13040}, {'name': 'Paragon Entertainment Corp.', 'id': 24217}]","[{'iso_3166_1': 'US', 'name': 'United States of America'}]",1994-06-24,25052000,191.0,"[{'iso_639_1': 'en', 'name': 'English'}]",Released,The epic story of love and adventure in a lawless land.,Wyatt Earp,False,6.5,203,379,"[{'id': 75, 'name': 'gunslinger'}, {'id': 395, 'name': 'gambling'}, {'id': 798, 'name': 'sheriff'}, {'id': 1559, 'name': 'deputy sheriff'}, {'id': 4391, 'name': 'wretch'}, {'id': 5074, 'name': 'wyatt earp'}, {'id': 6165, 'name': 'historical figure'}, {'id': 9550, 'name': 'doc holliday'}]"
False,,0,"[{'id': 28, 'name': 'Action'}, {'id': 80, 'name': 'Crime'}, {'id': 10749, 'name': 'Romance'}, {'id': 53, 'name': 'Thriller'}]",,40480,tt0112443,en,Bad Company,"Nelson Crowe is a CIA operative under the thumb of the Company for a disputed delivery of $50,000 in gold. They blackmail him into working for the Grimes Organization, which is set up as a private company for hire, to blackmail prominent individuals. Crowe, working with Margaret Wells (another former Covert Operations operative), blackmails and bribes a State Supreme Court judge, but the deal sours. One of Crowe's co-workers, Tod Stapp, discovers Crowe's current CIA involvement in a plot to overthrow Grimes, and blackmails him to be cut in on the deal. More blackmail occurs as Wells manipulates Crowe to kill Grimes, then the CIA uses that discovery to blackmail Wells into killing Crowe. Who can you trust???",0.912415,/5q5r3cpaTDByz4qko9ZWHlK3gMF.jpg,"[{'name': 'Touchstone Pictures', 'id': 9195}, {'name': 'Tool Shed Productions', 'id': 21857}]","[{'iso_3166_1': 'US', 'name': 'United States of America'}]",1995-01-20,0,108.0,"[{'iso_639_1': 'en', 'name': 'English'}]",Released,Bribery. Blackmail. Murder. Specialities of the house.,Bad Company,False,4.9,12,380,"[{'id': 591, 'name': 'cia'}, {'id': 934, 'name': 'judge'}, {'id': 1936, 'name': 'blackmail'}]"
False,,0,"[{'id': 35, 'name': 'Comedy'}, {'id': 18, 'name': 'Drama'}]",,52038,tt0110455,en,A Man of No Importance,"Alfie Byrne is a middle-aged bus conductor in Dublin in 1963. He would appear to live a life of quiet desperation: he's gay, but firmly closeted, and his sister is always trying to find him ""the right girl"". His passion is Oscar Wilde, his hobby is putting on amateur theatre productions in the local church hall. We follow him as he struggles with temptation, friendship, disapproval, and the conservative yet oddly lyrical world of Ireland in the early 1960s.",0.406113,/nSBeudgK6eFA1kzSAR4b8ndZked.jpg,"[{'name': 'BBC Films', 'id': 288}, {'name': 'Majestic Films International', 'id': 2630}, {'name': 'Little Bird', 'id': 11358}]","[{'iso_3166_1': 'GB', 'name': 'United Kingdom'}, {'iso_3166_1': 'IE', 'name': 'Ireland'}]",1994-12-22,953,99.0,"[{'iso_639_1': 'en', 'name': 'English'}]",Released,An extraordinary tale of an ordinary hero.,A Man of No Importance,False,6.5,2,381,"[{'id': 237, 'name': 'gay'}, {'id': 4729, 'name': 'dublin'}, {'id': 6054, 'name': 'friendship'}, {'id': 14985, 'name': 'ireland'}, {'id': 163110, 'name': 'theater'}, {'id': 176793, 'name': 'middle age'}, {'id': 208383, 'name': 'oscar wilde'}]"
False,,0,"[{'id': 35, 'name': 'Comedy'}, {'id': 18, 'name': 'Drama'}]",,29444,tt0111048,en,S.F.W.,An alienated and misanthropic teenager gains sudden and unwanted celebrity status after he's taken hostage by terrorists where his indifference to their threats to kill him makes news headlines.,2.504529,/3bq91jWCReRrqlPn81alSoxeXoP.jpg,"[{'name': 'Gramercy Pictures', 'id': 37}, {'name': 'PolyGram Filmed Entertainment', 'id': 1382}]","[{'iso_3166_1': 'US', 'name': 'United States of America'}]",1994-09-15,0,96.0,"[{'iso_639_1': 'en', 'name': 'English'}]",Released,Fate made them hostages. The media made them stars.,S.F.W.,False,6.1,22,382,"[{'id': 963, 'name': 'loss of brother'}, {'id': 1562, 'name': 'hostage'}, {'id': 2571, 'name': 'tv show'}, {'id': 6007, 'name': 'media'}, {'id': 6562, 'name': 'celebrity'}, {'id': 10685, 'name': 'escape'}, {'id': 10809, 'name': 'teenage girl'}, {'id': 11612, 'name': 'hospital'}, {'id': 13130, 'name': 'teenager'}, {'id': 15069, 'name': 'masked man'}, {'id': 15249, 'name': 'tragic event'}, {'id': 15402, 'name': 'popularity'}, {'id': 156064, 'name': 'homecoming'}, {'id': 158584, 'name': 'tv news'}]"
False,,10000000,"[{'id': 28, 'name': 'Action'}, {'id': 35, 'name': 'Comedy'}, {'id': 80, 'name': 'Crime'}]",,26352,tt0110399,en,A Low Down Dirty Shame,"A black detective becomes embroiled in a web of danger while searching for a fortune in missing drug money. During the course of his investigation, he encounters various old connections, ultimately confronting the criminal responsible for Shame's expulsion from the force. He must also deal with two women, Angela, a beautiful old flame, and Peaches, his energetic but annoying sidekick.",3.021526,/v5XUfLrdoGfatObGXhqckYTNqFT.jpg,"[{'name': 'Caravan Pictures', 'id': 175}, {'name': 'Hollywood Pictures', 'id': 915}]","[{'iso_3166_1': 'US', 'name': 'United States of America'}]",1994-11-23,29392418,100.0,"[{'iso_639_1': 'en', 'name': 'English'}]",Released,He's armed and dangerously funny.,A Low Down Dirty Shame,False,6.0,31,383,"[{'id': 1812, 'name': 'fbi'}, {'id': 2151, 'name': 'drug crime'}, {'id': 14819, 'name': 'violence'}, {'id': 14964, 'name': 'drug'}, {'id': 155790, 'name': 'private detective'}, {'id': 222423, 'name': 'blast'}]"
False,,0,"[{'id': 18, 'name': 'Drama'}]",,39953,tt0112570,en,"Boys Life: Three Stories of Love, Lust, and Liberation","Each of the three short films in this collection presents a young gay man at the threshold of adulthood. In ""Pool Days,"" Justin is a 17-year old Bethesda lad, hired as the evening life guard at a fitness center. In the course of the summer, he realizes and embraces that he's gay. In ""A Friend of Dorothy,"" Winston arrives from upstate for his freshman year at NYU. He has to figure out, with some help from Anne, a hometown friend, how to build a social life as a young gay man in the city. In ""The Disco Years,"" Tom looks back on 1978, the year in high school that he came out of the closet after one joyful and several painful encounters",0.054148,/jXKecGbSp36C486myi1pbe6EKAI.jpg,"[{'name': 'Strand Releasing', 'id': 3923}, {'name': 'Strand Home Video', 'id': 25583}]","[{'iso_3166_1': 'US', 'name': 'United States of America'}]",1994-09-30,0,91.0,"[{'iso_639_1': 'en', 'name': 'English'}]",Released,"3 Tales of Love, Lust, & Liberation","Boys Life: Three Stories of Love, Lust, and Liberation",False,2.0,1,384,[]
False,,0,"[{'id': 18, 'name': 'Drama'}]",,41580,tt0109454,fr,Le colonel Chabert,"Colonel Chabert has been severely wounded in the French-Russian Napoleonic war to the point that the medical examiner has signed his death certificate. When he regains his health and memory, he goes back to Paris, where his ""widow"", Anne has married the Count Ferraud and is financing his rise to power using Chabert's money. Chabert hires a lawyer to help him get back his money and his honor.",0.934312,/qY9waC3FdCHPf3aMgF8l3qVqzn6.jpg,[],"[{'iso_3166_1': 'FR', 'name': 'France'}]",1994-01-01,0,110.0,"[{'iso_639_1': 'fr', 'name': 'Français'}]",Released,,Colonel Chabert,False,5.9,9,385,[]
False,,45000,"[{'id': 28, 'name': 'Action'}, {'id': 80, 'name': 'Crime'}]",,315,tt0059170,en,"Faster, Pussycat! Kill! Kill!","Three strippers seeking thrills encounter a young couple in the desert. After dispatching the boyfriend, they take the girl hostage and begin scheming on a crippled old man living with his two sons in the desert, reputedly hiding a tidy sum of cash. They become house guests of the old man and try and seduce the sons in an attempt to locate the money, not realizing that the old man has a few sinister intentions of his own.",4.220541,/4mld2L1vWqgqFQmKa7KU4HzLKPi.jpg,"[{'name': 'Eve Productions Inc.', 'id': 170}]","[{'iso_3166_1': 'US', 'name': 'United States of America'}]",1965-08-06,0,83.0,"[{'iso_639_1': 'en', 'name': 'English'}]",Released,Go-Go For a Wild Ride With the ACTION GIRLS!,"Faster, Pussycat! Kill! Kill!",False,6.5,59,386,"[{'id': 627, 'name': 'killing'}, {'id': 999, 'name': 'sports car'}, {'id': 1663, 'name': 'go-go dancer'}, {'id': 1664, 'name': 'eroticism'}, {'id': 1930, 'name': 'kidnapping'}, {'id': 10183, 'name': 'independent film'}, {'id': 11034, 'name': 'b movie'}, {'id': 18450, 'name': 'exploitation film'}]"
False,,7000000,"[{'id': 80, 'name': 'Crime'}, {'id': 18, 'name': 'Drama'}, {'id': 10749, 'name': 'Romance'}]",,22067,tt0110186,en,Jason's Lyric,The story of a young man who must confront his own fears about love as well as his relationships with family and friends.,0.912909,/y3ZZJFdTYd4SezXv1gjRv19Jy32.jpg,[],"[{'iso_3166_1': 'US', 'name': 'United States of America'}]",1994-09-28,20851521,119.0,"[{'iso_639_1': 'en', 'name': 'English'}]",Released,Love is courage.,Jason's Lyric,False,5.9,9,387,"[{'id': 10235, 'name': 'family relationships'}, {'id': 13073, 'name': 'fear'}, {'id': 14534, 'name': 'relationship'}, {'id': 208282, 'name': 'gospel singer'}]"
False,,0,"[{'id': 16, 'name': 'Animation'}, {'id': 878, 'name': 'Science Fiction'}]",,18242,tt0108069,en,The Secret Adventures of Tom Thumb,A boy born the size of a small doll is kidnapped by a genetic lab and must find a way back to his father in this inventive adventure filmed using stop motion animation techniques.,0.381704,/98yogK8pBvjqpQ7mtohuaBMLUJv.jpg,"[{'name': 'Bolex Brothers', 'id': 6215}, {'name': 'Lumen Films', 'id': 6216}, {'name': 'Tara', 'id': 6217}]","[{'iso_3166_1': 'GB', 'name': 'United Kingdom'}]",1993-12-10,0,61.0,"[{'iso_639_1': 'en', 'name': 'English'}]",Released,A nursery crime of epic proportions...,The Secret Adventures of Tom Thumb,False,7.1,8,388,"[{'id': 10121, 'name': 'stop motion'}]"
False,"{'id': 261203, 'name': 'Street Fighter', 'poster_path': '/srmcIOxfqARcnHmgHLVNzzFM2RV.jpg', 'backdrop_path': '/u5w0uNoQDqUkmErqMsh4RVVOgyy.jpg'}",35000000,"[{'id': 28, 'name': 'Action'}, {'id': 12, 'name': 'Adventure'}, {'id': 53, 'name': 'Thriller'}]",,11667,tt0111301,en,Street Fighter,Col. Guile and various other martial arts heroes fight against the tyranny of Dictator M. Bison and his cohorts.,13.58449,/6yh95dD2Y6uWAlPfWCZZygBM1ec.jpg,"[{'name': 'Universal Pictures', 'id': 33}, {'name': 'Capcom', 'id': 7220}]","[{'iso_3166_1': 'JP', 'name': 'Japan'}, {'iso_3166_1': 'US', 'name': 'United States of America'}]",1994-12-22,99423521,102.0,"[{'iso_639_1': 'en', 'name': 'English'}, {'iso_639_1': 'ja', 'name': '日本語'}]",Released,The fight to save the world is on!,Street Fighter,False,4.1,330,389,"[{'id': 407, 'name': 'dictator'}, {'id': 779, 'name': 'martial arts'}, {'id': 1562, 'name': 'hostage'}, {'id': 5362, 'name': 'liberation of hostage'}, {'id': 7188, 'name': 'hostage-taking'}, {'id': 10076, 'name': 'street fighter'}, {'id': 15053, 'name': 'united nations'}, {'id': 41645, 'name': 'based on video game'}]"
False,,0,"[{'id': 28, 'name': 'Action'}, {'id': 35, 'name': 'Comedy'}]",,32502,tt0112702,en,Coldblooded,"Cosmo, an affectless mob bookie who lives in the basement of a retirement home, is promoted to hitman. He learns his new trade from Steve, a seasoned killer. He falls in love with a yoga teacher, Jasmine, and must figure out a way to leave the mob so they can be together.",2.342756,/zfU3QJVqnY3wW1La9ptrOYGFdbP.jpg,"[{'name': 'Propaganda Films', 'id': 278}, {'name': 'Motion Picture Corporation of America (MPCA)', 'id': 11061}, {'name': 'Polygram Filmed Entertainment', 'id': 31080}, {'name': 'Snowback Productions', 'id': 33419}]","[{'iso_3166_1': 'US', 'name': 'United States of America'}]",1995-09-15,0,92.0,"[{'iso_639_1': 'en', 'name': 'English'}]",Released,,Coldblooded,False,6.7,13,390,"[{'id': 2708, 'name': 'hitman'}, {'id': 2820, 'name': 'wound'}, {'id': 5828, 'name': 'yoga'}, {'id': 8636, 'name': 'blood splatter'}, {'id': 9826, 'name': 'murder'}, {'id': 9866, 'name': 'basement'}, {'id': 11221, 'name': 'blood'}]"
False,,0,[],,267188,tt0112849,en,Desert Winds,"Jackie and Eugene are joined by a mystical wind tunnel which enables them to speak across a 500-mile desert. Believed by the Indians to be an omen of good luck, the wind inspires both characters to face their fears and follow their hearts.",0.251223,/vvceS641s5Sh4ec660nhnMXHnh2.jpg,[],[],1997-12-31,0,97.0,[],Released,It began with a whisper,Desert Winds,False,0.0,0,391,[]
False,,0,"[{'id': 28, 'name': 'Action'}, {'id': 12, 'name': 'Adventure'}, {'id': 80, 'name': 'Crime'}, {'id': 18, 'name': 'Drama'}, {'id': 53, 'name': 'Thriller'}]",,28732,tt0113014,en,Fall Time,"Three young men decide to plan a mock kidnapping, but everything goes wrong because a real bank robbery was already planned by two other guys.",1.108494,/rYFexSIWUXNhuIdTIVcvZSEGe5G.jpg,"[{'name': 'Live Entertainment', 'id': 285}, {'name': 'Capitol Films', 'id': 826}, {'name': 'Bates Entertainmant', 'id': 16835}]","[{'iso_3166_1': 'US', 'name': 'United States of America'}]",1995-05-13,0,88.0,"[{'iso_639_1': 'en', 'name': 'English'}]",Released,"Wrong People, Wrong Place, Wrong Time.",Fall Time,False,6.3,6,392,"[{'id': 9864, 'name': 'prank'}, {'id': 10183, 'name': 'independent film'}, {'id': 15363, 'name': 'bank robbery'}]"
False,"{'id': 439409, 'name': 'Fear Collection', 'poster_path': None, 'backdrop_path': None}",0,"[{'id': 27, 'name': 'Horror'}, {'id': 53, 'name': 'Thriller'}]",,75555,tt0113043,en,The Fear,A weekend of 'fear therapy' turns into a nightmare of terror when a mannequin comes to life. Only those with the courage to confront their demons will survive.,0.268043,/75n6huahUprQ6CsgCFb4tV6UBSP.jpg,"[{'name': 'A-Pix Entertainment', 'id': 14280}, {'name': 'Devin Entertainment', 'id': 37300}]","[{'iso_3166_1': 'US', 'name': 'United States of America'}]",1995-01-20,0,98.0,"[{'iso_639_1': 'en', 'name': 'English'}]",Released,He's whatever scares you the most,The Fear,False,3.4,7,393,"[{'id': 2863, 'name': 'mannequin'}, {'id': 6152, 'name': 'supernatural'}, {'id': 11034, 'name': 'b movie'}, {'id': 34117, 'name': 'cult film'}, {'id': 208293, 'name': 'wood'}]"
False,,0,"[{'id': 99, 'name': 'Documentary'}]",,42981,tt0113104,en,Frank and Ollie,"Before computer graphics, special effects wizardry, and out-of-this world technology, the magic of animation flowed from the pencils of two of the greatest animators The Walt Disney Company ever produced -- Frank Thomas and Ollie Johnston. Frank and Ollie, the talent behind BAMBI, PINOCCHIO, LADY AND THE TRAMP, THE JUNGLE BOOK, and others, set the standard for such modern-day hits as THE LION KING. It was their creative genius that helped make Disney synonymous with brilliant animation, magnificent music, and emotional storytelling. Take a journey with these extraordinary artists as they share secrets, insights, and the inspiration behind some of the greatest animated movies the world has ever known!",0.142357,/eUIELE2IkuWkAc3JzjYz6J2Lpx5.jpg,"[{'name': 'Walt Disney Pictures', 'id': 2}, {'name': 'Theodore Thomas Productions', 'id': 90509}]","[{'iso_3166_1': 'US', 'name': 'United States of America'}]",1995-10-20,0,89.0,[],Released,,Frank and Ollie,False,7.5,4,394,"[{'id': 6966, 'name': 'film history'}, {'id': 217987, 'name': 'animation filmmaking'}]"
